{
  "eventId": "88888888-8888-4888-8888-888888888888",
  "eventType": "dispatch.closed.v1",
  "aggregateId": "req_2026_0001",
  "correlationId": "aaaaaaaa-aaaa-4aaa-8aaa-aaaaaaaaaaaa",
  "occurredAt": "2026-08-23T10:19:00Z",
  "producer": "dispatch-service",
  "schemaVersion": 1,
  "payload": {
    "requestId": "req_2026_0001",
    "professionalId": "pro_cardio_01",
    "slotId": "slot_pro_cardio_01_1000",
    "closedAt": "2026-08-23T10:19:00Z",
    "resolutionStatus": "COMPLETED",
    "ttfaMs": 7000,
    "ttrMs": 1140000
  }
}
