{
  "eventId": "44444444-4444-4444-8444-444444444444",
  "eventType": "dispatch.proposed.v1",
  "aggregateId": "req_2026_0001",
  "correlationId": "aaaaaaaa-aaaa-4aaa-8aaa-aaaaaaaaaaaa",
  "occurredAt": "2026-08-23T10:00:07Z",
  "producer": "dispatch-service",
  "schemaVersion": 1,
  "payload": {
    "requestId": "req_2026_0001",
    "professionalId": "pro_cardio_01",
    "slotId": "slot_pro_cardio_01_1000",
    "strategy": "S5",
    "proposalDeadlineAt": "2026-08-23T10:00:37Z",
    "attemptNumber": 1,
    "score": 0.91
  }
}
